{"schema_version": "gms.merge-proposal-event.v1", "proposal_ref": {"id": "mp-0003", "version": 1, "digest": "sha256:05c0732e86204d28159a73af21bd67886c01a2c947a49dd5a85680b2103e8472"}, "event_sequence": 6, "event_id": "mpe-0003", "event_digest": "sha256:c94b5e7525db44d642fcd98ecc1a2bb0d17dadfb972931feb348fd6bce53e049", "from_state": "activation_pending", "to_state": "stale", "reason_codes": ["SOURCE_HEAD_CAS_FAILURE"], "authority_ref": {"id": "gms.activation.v1", "version": 1, "digest": "sha256:70b7c7134082385928506fca4d243b35657add6e8e977f225a6b07cfbc2939fd"}, "record_refs": [{"id": "mp-0003", "version": 1, "digest": "sha256:05c0732e86204d28159a73af21bd67886c01a2c947a49dd5a85680b2103e8472"}, {"schema_version": "gms.skill-artifact-ref.v2", "lineage_id": "sg-beta", "version": 2, "kind": "step_guidance", "artifact_digest": "sha256:97dfcb20336c6ab04fa5876b5538b3f1319c3dae973865a2b4b83b76b736e4fc"}], "observed_source_heads": [{"schema_version": "gms.skill-artifact-ref.v2", "lineage_id": "sg-alpha", "version": 2, "kind": "step_guidance", "artifact_digest": "sha256:f0a312792f18a320fcd20e05ae9728d26979c08c10e5b872e6120946cfd55823"}, {"schema_version": "gms.skill-artifact-ref.v2", "lineage_id": "sg-beta", "version": 2, "kind": "step_guidance", "artifact_digest": "sha256:97dfcb20336c6ab04fa5876b5538b3f1319c3dae973865a2b4b83b76b736e4fc"}], "expected_previous_event_sequence": 5}
