{"schema_version": "gms.merge-proposal-event.v1", "proposal_ref": {"id": "mp-0002", "version": 1, "digest": "sha256:7e2548516d082286ee9bf0157429db47825f426d1fe2f9e51310b46227ea5493"}, "event_sequence": 3, "event_id": "mpe-0002", "event_digest": "sha256:86633315ff48023823831591b90281a9db30bae8f156ec5667df0f6bed7d01e8", "from_state": "proposed", "to_state": "duplicate", "reason_codes": ["EXACT_DUPLICATE_PAIR"], "authority_ref": {"id": "gms.admission.v1", "version": 1, "digest": "sha256:29529b790f105302a8627ce789c6050e00c4fe59657bc3b3bfddb8786d1ff476"}, "record_refs": [{"id": "mp-0001", "version": 1, "digest": "sha256:da77795558957d1d8d7d2f614fb347de4b044bfecd6d5eab840cb86d034a00f6"}], "observed_source_heads": [{"schema_version": "gms.skill-artifact-ref.v1", "lineage_id": "sg-alpha", "version": 2, "kind": "step_guidance", "artifact_digest": "sha256:f0a312792f18a320fcd20e05ae9728d26979c08c10e5b872e6120946cfd55823"}, {"schema_version": "gms.skill-artifact-ref.v1", "lineage_id": "sg-beta", "version": 1, "kind": "step_guidance", "artifact_digest": "sha256:d885c42ee6d6f72fdfa50ed1be68b9f1b562b50d1dfb5a1d5e880494af9a396f"}], "expected_previous_event_sequence": 2}
